{
  "run_id": "benchmark_medium_goal_20260506091030",
  "status": "DONE_PASS",
  "passed_checks": [
    "goal_contract.json exists",
    "goal_contract.json parses as JSON",
    "trace.jsonl exists",
    "trace.jsonl lines parse as JSON",
    "step_logs contain at least one step result",
    "1.json contains evidence",
    "done_criteria is non-empty",
    "final_outputs is non-empty",
    "final output exists: docs/examples.md"
  ],
  "failed_checks": [],
  "artifact_hashes": {
    "docs/examples.md": "cf1496154cd38875933faa0ae87de7302f96ba5c3683bc97a1882452dd4fc33a"
  },
  "audit_chain_valid": true,
  "generated_by": "agentic-pi-certifier-v0.1",
  "timestamp": "2026-05-06T09:10:32.307112+00:00"
}