{
  "run_id": "repairtest",
  "status": "DONE_FAIL",
  "passed_checks": [
    "goal_contract.json exists",
    "goal_contract.json parses as JSON",
    "step_logs contain at least one step result",
    "done_criteria is non-empty",
    "final_outputs is non-empty",
    "final output exists: hello.py",
    "formal_verification: no artifacts dir (informational)",
    "crypto_signatures: no signatures found (informational)",
    "final_status.json validated"
  ],
  "failed_checks": [
    "trace.jsonl missing",
    "1.json field files_touched has wrong type: expected list",
    "1.json files_touched must contain at least one path",
    "Python script hello.py exit=0, lines=1"
  ],
  "artifact_hashes": {
    "hello.py": "b80792336156c7b0f7fe02eeef24610d2d52a10d1810397744471d1dc5738180"
  },
  "audit_chain_valid": false,
  "generated_by": "agentic-pi-certifier-v0.3.6",
  "timestamp": "2026-05-10T10:31:45.791168+00:00"
}