{
  "run_id": "iter_test",
  "status": "CERTIFIED_DONE",
  "passed_checks": [
    "verifier_contract.json exists",
    "verifier_contract.json parses as JSON",
    "goal_contract.json exists",
    "goal_contract.json parses as JSON",
    "trace.jsonl exists",
    "trace.jsonl lines parse as JSON",
    "step_logs contain at least one step result",
    "1.json evidence maps to touched files",
    "PlanGraph validation passed",
    "done_criteria is non-empty",
    "final_outputs is non-empty",
    "final output exists: longest_palindrome.py",
    "Python module longest_palindrome.py imports cleanly",
    "verifier target artifact exists: longest_palindrome.py",
    "verifier_artifacts contain 1 artifact(s)",
    "verifier smell scan recorded: V.ITER_TEST",
    "verifier strength score recorded: V.ITER_TEST=certifying",
    "policy_decision.json validates",
    "policy engine status: CERTIFIED_DONE",
    "evidence_index.json validates",
    "evidence_freeze.json validates",
    "final_status.json validated"
  ],
  "failed_checks": [],
  "artifact_hashes": {
    "longest_palindrome.py": "57c72c85ff2427534d0cc65f83e713eb6f1767265a86c927f054f369ae557723"
  },
  "audit_chain_valid": true,
  "generated_by": "agentic-pi-certifier-v0.3.6",
  "timestamp": "2026-05-10T08:11:20.876554+00:00"
}