{
  "run_id": "he_h129",
  "status": "DONE_PASS",
  "passed_checks": [
    "goal_contract.json exists",
    "goal_contract.json parses as JSON",
    "trace.jsonl exists",
    "trace.jsonl lines parse as JSON",
    "step_logs contain at least one step result",
    "1.json evidence maps to touched files",
    "done_criteria is non-empty",
    "final_outputs is non-empty",
    "final output exists: minPath.py",
    "Python module minPath.py imports cleanly",
    "final_status.json validated"
  ],
  "failed_checks": [],
  "artifact_hashes": {
    "minPath.py": "dfa6f0122404198f4d9f1d510da0bd0c248852b1cd1077a4777c40d1a43f9e9f"
  },
  "audit_chain_valid": true,
  "generated_by": "agentic-pi-certifier-v0.3.6",
  "timestamp": "2026-05-10T06:56:38.421726+00:00"
}