{
  "run_id": "benchmark_hard_goal_20260506091144",
  "status": "DONE_PASS",
  "passed_checks": [
    "goal_contract.json exists",
    "goal_contract.json parses as JSON",
    "trace.jsonl exists",
    "trace.jsonl lines parse as JSON",
    "step_logs contain at least one step result",
    "1.json contains evidence",
    "done_criteria is non-empty",
    "final_outputs is non-empty",
    "final output exists: cli_tool.py"
  ],
  "failed_checks": [],
  "artifact_hashes": {
    "cli_tool.py": "6731ceb4f3bdbe334d3897cfb5f127eb08ddc64c0ecedb60d688a91d33a78b8f"
  },
  "audit_chain_valid": true,
  "generated_by": "agentic-pi-certifier-v0.1",
  "timestamp": "2026-05-06T09:11:46.263575+00:00"
}