{
  "run_id": "qrspi_final",
  "status": "NOT_DONE",
  "passed_checks": [
    "verifier_contract.json exists",
    "verifier_contract.json parses as JSON",
    "goal_contract.json exists",
    "goal_contract.json parses as JSON",
    "policy_decision.json validates",
    "policy engine status: NOT_DONE",
    "final_status.json validated"
  ],
  "failed_checks": [
    "verifier_contract.json schema validation failed: $: missing required field 'run_id'",
    "verifier_contract.json schema validation failed: $: missing required field 'target_goal'",
    "verifier_contract.json schema validation failed: $: missing required field 'target_artifacts'",
    "verifier_contract.json schema validation failed: $: missing required field 'required_verifier_level'",
    "verifier_contract.json schema validation failed: $: missing required field 'allow_self_generated_only'",
    "verifier_contract.json schema validation failed: $: missing required field 'required_behaviors'",
    "verifier_contract.json schema validation failed: $: missing required field 'forbidden_verifier_patterns'",
    "verifier_contract.json schema validation failed: $: missing required field 'minimum_strength_level'",
    "verifier_contract.json schema validation failed: $: missing required field 'certifying_authority_levels'",
    "verifier_contract.json schema validation failed: $: missing required field 'provisional_authority_levels'",
    "verifier_contract.json schema validation failed: $: unexpected field 'requirements'",
    "trace.jsonl missing",
    "step_logs directory missing",
    "done_criteria is empty",
    "final_outputs is empty",
    "evidence_index.json invalid: evidence_index.json missing required evidence kinds: ['STEP_LOG', 'TRACE']"
  ],
  "artifact_hashes": {},
  "audit_chain_valid": false,
  "generated_by": "agentic-pi-certifier-v0.3.6",
  "timestamp": "2026-05-10T04:33:46.152455+00:00"
}