{
  "run_id": "benchmark_simple_goal_20260506091032",
  "status": "DONE_PASS",
  "passed_checks": [
    "goal_contract.json exists",
    "goal_contract.json parses as JSON",
    "trace.jsonl exists",
    "trace.jsonl lines parse as JSON",
    "step_logs contain at least one step result",
    "1.json contains evidence",
    "done_criteria is non-empty",
    "final_outputs is non-empty",
    "final output exists: README.md"
  ],
  "failed_checks": [],
  "artifact_hashes": {
    "README.md": "c03a26755a70424d31a99218d5b0a9e36d82caf0dc2c942a560e0d70bd94012f"
  },
  "audit_chain_valid": true,
  "generated_by": "agentic-pi-certifier-v0.1",
  "timestamp": "2026-05-06T09:10:33.787349+00:00"
}