{
  "run_id": "he_hd",
  "status": "DONE_PASS",
  "passed_checks": [
    "goal_contract.json exists",
    "goal_contract.json parses as JSON",
    "trace.jsonl exists",
    "trace.jsonl lines parse as JSON",
    "step_logs contain at least one step result",
    "1.json evidence maps to touched files",
    "done_criteria is non-empty",
    "final_outputs is non-empty",
    "final output exists: Strongest_Extension.py",
    "Python module Strongest_Extension.py imports cleanly",
    "final_status.json validated"
  ],
  "failed_checks": [],
  "artifact_hashes": {
    "Strongest_Extension.py": "99e8155fc9bf7b7857b81413dc7b9bb5604c3c2fe24d382d133b0dc091c6501b"
  },
  "audit_chain_valid": true,
  "generated_by": "agentic-pi-certifier-v0.3.6",
  "timestamp": "2026-05-10T06:35:50.170286+00:00"
}