{
  "run_id": "he_h95",
  "status": "DONE_PASS",
  "passed_checks": [
    "goal_contract.json exists",
    "goal_contract.json parses as JSON",
    "trace.jsonl exists",
    "trace.jsonl lines parse as JSON",
    "step_logs contain at least one step result",
    "1.json evidence maps to touched files",
    "done_criteria is non-empty",
    "final_outputs is non-empty",
    "final output exists: check_dict_case.py",
    "Python module check_dict_case.py imports cleanly",
    "final_status.json validated"
  ],
  "failed_checks": [],
  "artifact_hashes": {
    "check_dict_case.py": "39541e0bfdc55060998e9c380a4d425e2ec580306e97554d04a2d5efe2e3c9d4"
  },
  "audit_chain_valid": true,
  "generated_by": "agentic-pi-certifier-v0.3.6",
  "timestamp": "2026-05-10T06:42:00.160478+00:00"
}