{
  "run_id": "agentfix",
  "status": "DONE_FAIL",
  "passed_checks": [
    "goal_contract.json exists",
    "goal_contract.json parses as JSON",
    "trace.jsonl exists",
    "trace.jsonl lines parse as JSON",
    "step_logs contain at least one step result",
    "1.json evidence maps to touched files",
    "PlanGraph validation passed",
    "done_criteria is non-empty",
    "final_outputs is non-empty",
    "final output exists: reverse_string.py",
    "Python script reverse_string.py produced >=2 lines of output",
    "crypto_signatures: no signatures found (informational)",
    "final_status.json validated"
  ],
  "failed_checks": [
    "formal_verification: F_AGENTFIX FAIL (confidence=0.00)"
  ],
  "artifact_hashes": {
    "reverse_string.py": "240d1dfc7394a2ec0e53f1581bc80fc466d24794deb726e0d08b1b313b2139e3"
  },
  "audit_chain_valid": false,
  "generated_by": "agentic-pi-certifier-v0.3.6",
  "timestamp": "2026-05-10T10:25:09.306793+00:00"
}